{
    "slot": 1,
    "multi_set_enabled": true,
    "timeout": 100,
    "detail_level": "MINIMAL",
    "params": {
        "hello": {
            "param": {
                "name": {
                    "monoglot": "example defined inline"
                },
                "type": {
                    "type": "FLOAT32"
                },
                "value": {
                    "float32_value": 12.3
                },
                "constraint": {
                    "type": "FLOAT_RANGE",
                    "float_range": {
                        "min_value": 0.0,
                        "max_value": 1.0
                    }
                }
            }
        },
        "world": {
            "import": {}
        },
        "string_examples": {
            "import": {}
        },
        "tape_transport": {
            "import": {
                "excluding": [
                    "/commands/eject",
                    "/commands/load"
                ]
            }
        }
    }
}
